[
  {
    "id": "exemplar-of-the-kauyon-kauyon",
    "name": "Exemplar of the Kauyon",
    "detachment_id": "kauyon",
    "cost": 20,
    "keyword_restrictions": [
      "T’au Empire"
    ],
    "ability_id": "exemplar-of-the-kauyon-kauyon",
    "is_unique": true,
    "game_version": {
      "edition": "11th",
      "dataslate": "launch"
    },
    "points_provisional": false,
    "upgrade_tag": false,
    "max_targets": 1,
    "exclusion_keywords": [
      "Shaper"
    ],
    "external_refs": [
      {
        "namespace": "game-datacards",
        "id": "20d5d26e-cda1-50e2-8218-32b8365fb387"
      },
      {
        "namespace": "mfm",
        "id": "27f8a5da-290d-4f58-882b-6f364d2e4658"
      }
    ]
  },
  {
    "id": "precision-of-the-patient-hunter-kauyon",
    "name": "Precision of the Patient Hunter",
    "detachment_id": "kauyon",
    "cost": 15,
    "keyword_restrictions": [
      "T’au Empire"
    ],
    "ability_id": "precision-of-the-patient-hunter-kauyon",
    "is_unique": true,
    "game_version": {
      "edition": "11th",
      "dataslate": "launch"
    },
    "points_provisional": false,
    "upgrade_tag": false,
    "max_targets": 1,
    "external_refs": [
      {
        "namespace": "game-datacards",
        "id": "29c3bf37-3290-528c-93fd-76a1124c9590"
      },
      {
        "namespace": "mfm",
        "id": "7c538bba-1367-4adc-b54b-bea749daa8a5"
      }
    ]
  },
  {
    "id": "solid-image-projection-unit-kauyon",
    "name": "Solid-image Projection Unit",
    "detachment_id": "kauyon",
    "cost": 20,
    "keyword_restrictions": [
      "T’au Empire"
    ],
    "ability_id": "solid-image-projection-unit-kauyon",
    "is_unique": true,
    "game_version": {
      "edition": "11th",
      "dataslate": "launch"
    },
    "points_provisional": false,
    "upgrade_tag": false,
    "max_targets": 1,
    "external_refs": [
      {
        "namespace": "game-datacards",
        "id": "3987f242-fb5e-5555-8891-c9b78bf944f2"
      },
      {
        "namespace": "mfm",
        "id": "2c695a2e-16e1-49c3-a9d7-1645494408ed"
      }
    ]
  },
  {
    "id": "through-unity-devastation-kauyon",
    "name": "Through Unity, Devastation",
    "detachment_id": "kauyon",
    "cost": 30,
    "keyword_restrictions": [
      "T’au Empire"
    ],
    "ability_id": "through-unity-devastation-kauyon",
    "is_unique": true,
    "game_version": {
      "edition": "11th",
      "dataslate": "launch"
    },
    "points_provisional": false,
    "upgrade_tag": false,
    "max_targets": 1,
    "exclusion_keywords": [
      "Shaper"
    ],
    "external_refs": [
      {
        "namespace": "game-datacards",
        "id": "43bb671a-4438-5387-8cf0-448261f72904"
      },
      {
        "namespace": "mfm",
        "id": "f65de9ae-c750-4ab8-bbb6-6459f9787c12"
      }
    ]
  },
  {
    "id": "exemplar-of-the-montka-montka",
    "name": "Exemplar of the Mont’ka",
    "detachment_id": "montka",
    "cost": 10,
    "keyword_restrictions": [
      "T’au Empire"
    ],
    "ability_id": "exemplar-of-the-montka-montka",
    "is_unique": true,
    "game_version": {
      "edition": "11th",
      "dataslate": "launch"
    },
    "points_provisional": false,
    "upgrade_tag": false,
    "max_targets": 1,
    "exclusion_keywords": [
      "Shaper"
    ],
    "external_refs": [
      {
        "namespace": "game-datacards",
        "id": "58ec8c96-448f-547c-864b-fc87f5152874"
      },
      {
        "namespace": "mfm",
        "id": "2b8f734a-448c-4013-9cc3-77acb6a3dae5"
      }
    ]
  },
  {
    "id": "strike-swiftly-montka",
    "name": "Strike Swiftly",
    "detachment_id": "montka",
    "cost": 45,
    "keyword_restrictions": [
      "T’au Empire"
    ],
    "ability_id": "strike-swiftly-montka",
    "is_unique": true,
    "game_version": {
      "edition": "11th",
      "dataslate": "launch"
    },
    "points_provisional": false,
    "upgrade_tag": false,
    "max_targets": 1,
    "external_refs": [
      {
        "namespace": "game-datacards",
        "id": "a616aabe-3222-581b-b576-8958225eefa2"
      },
      {
        "namespace": "mfm",
        "id": "f4e9290f-d6cd-469b-94cc-cf7b908c59ad"
      }
    ]
  },
  {
    "id": "strategic-conqueror-montka",
    "name": "Strategic Conqueror",
    "detachment_id": "montka",
    "cost": 15,
    "keyword_restrictions": [
      "T’au Empire"
    ],
    "ability_id": "strategic-conqueror-montka",
    "is_unique": true,
    "game_version": {
      "edition": "11th",
      "dataslate": "launch"
    },
    "points_provisional": false,
    "upgrade_tag": false,
    "max_targets": 1,
    "external_refs": [
      {
        "namespace": "game-datacards",
        "id": "e2b65797-2731-5fc3-8c73-73c911954bab"
      },
      {
        "namespace": "mfm",
        "id": "1ff1cc2a-ba28-4e1b-aee4-78c67b35a4de"
      }
    ]
  },
  {
    "id": "coordinated-exploitation-montka",
    "name": "Coordinated Exploitation",
    "detachment_id": "montka",
    "cost": 30,
    "keyword_restrictions": [
      "T’au Empire"
    ],
    "ability_id": "coordinated-exploitation-montka",
    "is_unique": true,
    "game_version": {
      "edition": "11th",
      "dataslate": "launch"
    },
    "points_provisional": false,
    "upgrade_tag": false,
    "max_targets": 1,
    "exclusion_keywords": [
      "Shaper"
    ],
    "external_refs": [
      {
        "namespace": "game-datacards",
        "id": "f3b67a49-b662-5196-a942-e64dd2a371b7"
      },
      {
        "namespace": "mfm",
        "id": "ee09770e-ecef-40eb-9435-f17af1b050ec"
      }
    ]
  },
  {
    "id": "puretide-engram-neurochip-retaliation-cadre",
    "name": "Puretide Engram Neurochip",
    "detachment_id": "retaliation-cadre",
    "cost": 15,
    "keyword_restrictions": [
      "Battlesuit",
      "T’au Empire"
    ],
    "ability_id": "puretide-engram-neurochip-retaliation-cadre",
    "is_unique": true,
    "game_version": {
      "edition": "11th",
      "dataslate": "launch"
    },
    "points_provisional": false,
    "upgrade_tag": false,
    "max_targets": 1,
    "external_refs": [
      {
        "namespace": "game-datacards",
        "id": "4687682c-84ca-50e4-bcc8-8c5ccedd85f2"
      },
      {
        "namespace": "mfm",
        "id": "f3733128-fb19-45f4-ab71-558181da1a31"
      }
    ]
  },
  {
    "id": "starflare-ignition-system-retaliation-cadre",
    "name": "Starflare Ignition System",
    "detachment_id": "retaliation-cadre",
    "cost": 20,
    "keyword_restrictions": [
      "Battlesuit",
      "T’au Empire"
    ],
    "ability_id": "starflare-ignition-system-retaliation-cadre",
    "is_unique": true,
    "game_version": {
      "edition": "11th",
      "dataslate": "launch"
    },
    "points_provisional": false,
    "upgrade_tag": false,
    "max_targets": 1,
    "external_refs": [
      {
        "namespace": "game-datacards",
        "id": "28e7bc02-636f-510a-ba46-d2cb491d1a66"
      },
      {
        "namespace": "mfm",
        "id": "846a78e3-fdb6-40a7-b6cb-5d3a01d40e16"
      }
    ]
  },
  {
    "id": "internal-grenade-racks-retaliation-cadre",
    "name": "Internal Grenade Racks",
    "detachment_id": "retaliation-cadre",
    "cost": 20,
    "keyword_restrictions": [
      "Battlesuit",
      "T’au Empire"
    ],
    "ability_id": "internal-grenade-racks-retaliation-cadre",
    "is_unique": true,
    "game_version": {
      "edition": "11th",
      "dataslate": "launch"
    },
    "points_provisional": false,
    "upgrade_tag": false,
    "max_targets": 1,
    "external_refs": [
      {
        "namespace": "game-datacards",
        "id": "3003886c-e0cc-5155-affe-f1ba0d44a93c"
      },
      {
        "namespace": "mfm",
        "id": "f73f4a42-c4b1-4ef7-bd9c-deaf79bc413d"
      }
    ]
  },
  {
    "id": "prototype-weapon-system-retaliation-cadre",
    "name": "Prototype Weapon System",
    "detachment_id": "retaliation-cadre",
    "cost": 15,
    "keyword_restrictions": [
      "Battlesuit",
      "T’au Empire"
    ],
    "ability_id": "prototype-weapon-system-retaliation-cadre",
    "is_unique": true,
    "game_version": {
      "edition": "11th",
      "dataslate": "launch"
    },
    "points_provisional": false,
    "upgrade_tag": false,
    "max_targets": 1,
    "external_refs": [
      {
        "namespace": "game-datacards",
        "id": "cee3489a-6c94-574d-b3dc-3157e603d498"
      },
      {
        "namespace": "mfm",
        "id": "1c7e5e47-c87c-411b-aac3-feb27ca0260c"
      }
    ]
  },
  {
    "id": "kroothawk-flock-kroot-hunting-pack",
    "name": "Kroothawk Flock",
    "detachment_id": "kroot-hunting-pack",
    "cost": 10,
    "keyword_restrictions": [
      "Kroot"
    ],
    "ability_id": "kroothawk-flock-kroot-hunting-pack",
    "is_unique": true,
    "game_version": {
      "edition": "11th",
      "dataslate": "launch"
    },
    "points_provisional": false,
    "upgrade_tag": false,
    "max_targets": 1,
    "external_refs": [
      {
        "namespace": "game-datacards",
        "id": "eb4257b9-3b55-56dc-8963-9126c3ade82a"
      },
      {
        "namespace": "mfm",
        "id": "b0b02250-29bc-4b8f-b501-a007e6fb45e6"
      }
    ]
  },
  {
    "id": "nomadic-hunter-kroot-hunting-pack",
    "name": "Nomadic Hunter",
    "detachment_id": "kroot-hunting-pack",
    "cost": 20,
    "keyword_restrictions": [
      "Trail Shaper"
    ],
    "ability_id": "nomadic-hunter-kroot-hunting-pack",
    "is_unique": true,
    "game_version": {
      "edition": "11th",
      "dataslate": "launch"
    },
    "points_provisional": false,
    "upgrade_tag": false,
    "max_targets": 1,
    "external_refs": [
      {
        "namespace": "game-datacards",
        "id": "d7cf45c9-3c45-5ce0-92c9-4a199702626c"
      },
      {
        "namespace": "mfm",
        "id": "7e5ea128-b5a8-4540-b84b-6b74bca2da44"
      }
    ]
  },
  {
    "id": "root-carved-weapons-kroot-hunting-pack",
    "name": "Root-carved Weapons",
    "detachment_id": "kroot-hunting-pack",
    "cost": 10,
    "keyword_restrictions": [